Topic,Percentage,song_id,song_name,artist,album,Like_Count,Lyric,cover_url,tags,year
1,0.4905848981806372,6046298,첫사랑 (feat.SOLE(쏠)),정준일,첫사랑 (feat.SOLE(쏠)),1773,설명이 어려운 밤  집에 가던 버스를 기다리다  문득 네 생각이나서  멍하니 창문 밖을 바라보다  혹시 너도 내 생각 하고 있을까  전화를 해볼까  아무렇지도 않게  조금 더 친해질거야  어제보다 잘 해줄거야  티나지 않게 너 모르게  더 가까이 날 보여줄거야  내일은 좀 더 날 알아볼 수 있게  조금 느리게 점점 더 가까이  다가가도 되겠니  같은 반 옆자리에 앉았던 날을 기억하니  그림 그리길 좋아했던  너의 연습장을 보여주던 그때  가까이 볼수록 두근대던 맘을  모른척 했던 건  내겐 다 처음이라서  조금 더 친해질거야  어제보다 잘 해줄거야  티나지 않게 너 모르게  더 가까이 날 보여줄거야  내일은 좀 더 날 알아볼 수 있게  조금 느리게 점점 더 가까이  다가가도 되겠니  우연히 너와 같은 시간에  함께 집에 오던 길  어색하게 네 손을 스칠때  마침 내리던 눈을 핑계삼아  널 안을때  나는 하늘을 나는 것만 같아  있잖아 내가 널 사랑해  꿈에서라도  먼저 고백해준다면  얼마나 좋을까  언젠간 너도 날 사랑할지 몰라  첫눈보다 더 기다렸던  너와 손 잡을지 몰라,https://image.bugsm.co.kr/album/images/200/40228/4022887.jpg?version=20210421042829.0,"['국내', '100시리즈', '2021년', '2021 뮤직PD 선곡 TOP100']",2021y
0,0.5775850468757993,6130989,찬란한 계절,폴킴(Paul Kim),찬란한 계절,1745,비가 내리는 반대편으로  여름을 향해 달리네  내게로 내미는 어떤 것도  끝내 붙잡지 못하고 말았네  피는 것보다 지는 게 더 많아서  찬란한 계절의 너는  어설픈 나의 맘에  차게 기울었지  나는 혼자 멈춰있는 채  날 많이 미워하고 있을 네가  너무 보고 싶어  난 왜 난 왜 난 왜  네게서 도망치지 못할까  반가운 얼굴을 보고도 모른 체  두 눈을 감았네  머릿속 그려낸 하늘은  두 눈으로 보는 것과 달라서  피는 것보다 적당히 또 지는 게  더 나을 것도 같아서  초라한 나의 맘의 창문을 닫은 채  먼지 속에서 숨 쉬는데  날 많이 미워하고 있을 네가  너무 보고 싶어  난 왜 난 왜 난 왜  네게서 도망치지 못할까  날 많이 미워하고 있을 네게  물어보고 싶어  넌 왜 넌 왜 넌 왜  내게서 떠나가지 않는지,https://image.bugsm.co.kr/album/images/200/40658/4065800.jpg?version=20211009004847.0,"['NewSongs', ""IT'S NEW! 신곡 에센셜""]",2021y
0,0.4938264034723893,6030580,어김없이 이 거리에,정승환,어김없이 이 거리에,1736,다 기억해 그 모든 걸  이맘때 우릴 감싸던 공기  막 차가워지던 바람  네 손을 잡았을 때의 온도  어색했던 첫인사를 나누던 날  어느새 너처럼 웃던 나  있지 돌아보면 모든 날이 좋았어  그저 너란 이유로  두 손 모아 불어 보던  입김에도 따스했었지  어김없이 이 거리에 겨울  꼭 함께 보고 싶다고  오로라 얘길 해주던 그 밤  난 그런 생각을 했어  내가 너의 곁이 되어야지  어제보다 오늘이 더 설레는  그런 사랑이 되고 싶어  다시 네가 좋아하는 그 계절이야  우리 처음 만났던  길 건너에 네가 보여  나는 항상 그게 꿈같아  어김없이 이 거리에 우리  약속처럼 기다리는 일  그 자리에 있어주는 일  내가 너의 그런 사람  그런 곳이 되고파  나의 따스함이 너이듯  다시 네가 좋아하는 그 계절이야  반가운 첫눈처럼  길 건너에 네가 있어  나는 항상 그게 꿈같아  달려가 널 안아야지  어김없이 이 거리에  잘 부탁해 우리의 겨울,https://image.bugsm.co.kr/album/images/200/40178/4017860.jpg?version=20210421042750.0,"['국내', '100시리즈', '2021년', '2021 뮤직PD 선곡 TOP100']",2021y
0,0.9873497752154325,6077792,꼬리 (TAIL),선미,꼬리 (TAIL),1729,날 똑바로 쳐다봐  처진 고개를 더 세워   온 신경이 곤두서  이건 아마도 널  할퀸 순간부터겠지        세상을 가진 것 마냥  이기적이게 그냥     뭐가 좋은데 그리 웃어대는데                 딱 거기까지만   니 입꼬리 올라가는 소리  여기까지 들려  아쉬워하기엔 너무 빨라  알잖아     우린 미친 듯이 사랑하고  미친 듯 입을 맞추고  미친 듯 머릴 흔들어  흔들어 흔들어  우린 미친 듯이 사랑하고  미친 듯 입을 맞추고  미친 듯 꼬릴 흔들어  흔들어 흔들어                물음표 물음표  그만 좀 물어 대  니 마지막 말에 꼬리치면  따다딱 거기까지만        세상을 가진 것 마냥  이기적이게 그냥     뭐가 좋은데 그리 웃어대는데                 딱 거기까지만   니 입꼬리 올라가는 소리  여기까지 들려  아쉬워하기엔 너무 빨라  알잖아     우린 미친 듯이 사랑하고  미친 듯 입을 맞추고  미친 듯 머릴 흔들어  흔들어 흔들어  우린 미친 듯이 사랑하고  미친 듯 입을 맞추고  미친 듯 꼬릴 흔들어  꼬리를 높이 세워  더 예민하게   꼬리를 높이 세워  더 예민하게  딱 거기 까지만   니 입꼬리 올라가는 소리  여기까지 들려  아쉬워하기엔 너무 빨라  알잖아     우린 미친 듯이 사랑하고  미친 듯 입을 맞추고  미친 듯 머릴 흔들어  흔들어 흔들어  우린 미친 듯이 사랑하고  미친 듯 입을 맞추고  미친 듯 꼬릴 흔들어  흔들어 흔들어,https://image.bugsm.co.kr/album/images/200/40314/4031422.jpg?version=20210421042947.0,"['국내', '가요', '여름', '여성보컬', 'KPOP', '아이돌']",2021y
2,0.9854484708492521,6029882,있잖아,DAY6 (Even of Day),[Vol.77] 유희열의 스케치북 : 마흔여덟 번째 목소리 '유스케 X DAY6 (Even of Day)',1718,있잖아 좀 늦은 거 아는데  해야 하는 말이 꼭 생겼어  아직 거기 서있다면  잠깐만 내 얘길 들어줄래  두드리고 계속 두드렸던  너를 왜 몰랐을까  닫힌 내 마음 앞에 앉아  날 기다린 것도 말야  지금 나 하나도 괜찮지가 않아  지금 널 이대로 그냥 잃어버릴까봐  널 보던 내 눈도 널 떠올리면  웃고 있던 내 입술도  사랑이더라  알잖아 보기엔 참 쉬운데  내가 하면 얘기가 다른 거  겨우 내 마음을 알았고  내겐 아직 많이 어려운데  근데 말야 나는 하고 싶어  너랑 그 연애란 거  사실 나 엄청 신경쓰여  너에 대한 모든 게 다  지금 나 하나도 괜찮지가 않아  지금 널 이대로 그냥 잃어버릴까봐  널 보던 내 눈도 널 떠올리면  웃고 있던 내 입술도  사랑이더라  딴 생각은 안 할 거야  이 감정에만 이젠 솔직할게  날 헷갈리게 만들던  그 이유를 좀 알 것 같아  궁금해 넌 어때 어서 대답해 봐  어떻게 생각해 지금 고백하는 거야  널 사랑한다고  가슴 벅차게 사랑하고 있다고  나 요즘에 너 때문에 괜찮지가 않아  지금 널 이대로 그냥 잃어버릴까봐  널 보던 내 눈도 널 떠올리며  웃고 있던 내 입술도  사랑이더라,https://image.bugsm.co.kr/album/images/200/40174/4017420.jpg?version=20210421042745.0,"['국내', '100시리즈', '2021년', '2021 뮤직PD 선곡 TOP100']",2021y
2,0.9901296766436061,32086459,혼술하고 싶은 밤,벤,혼술하고 싶은 밤,1681,위로받고 싶은 날 내겐 말해도 돼  위로받고 싶은 날 내겐 기대도 돼  비에 섞인 음악 소리에  혼자 젖은 새벽 감성에  때론 너무 지치고 때론 너무 지쳐서  가끔 아주 가끔  혼술하고 싶은 밤 전화해  혼자 있고 싶은 밤 전화해  참았던 눈물에 울컥해도 괜찮아  가끔 아주 가끔  혼술하고 싶은 밤 전화해  잠이 오지 않는 이 밤에  한 번쯤 소리 내 울컥해도 괜찮아  가끔 아주 가끔  웃고 싶지 않은 날 그냥 그래도 돼  도망치고 싶은 날 그래 떠나도 돼  비에 섞인 눈물 소리에  젖어 드는 슬픈 감정에  때론 너무 지치고 때론 너무 지쳐서  가끔 아주 가끔  혼술하고 싶은 밤 전화해  혼자 있고 싶은 밤 전화해  참았던 눈물에 울컥해도 괜찮아  가끔 아주 가끔  혼술하고 싶은 밤 전화해  잠이 오지 않는 이 밤에  한 번쯤 소리 내 울컥해도 괜찮아  가끔 아주 가끔  전부 이해할 수 없지만 내게 말해  참았던 눈물이 왈칵 쏟아질까 봐  미치게 답답해 울컥하는 마음에  가끔 기대도 돼 내게  혼술하고 싶은 밤 외로워  혼자라는 생각에 서러워  말없이 눈물로 소리쳐도 괜찮아  그래 울어도 돼  혼술하고 싶은 밤 외로워  잠이 오지 않는 이 밤에  한 번쯤 소리 내 울컥해도 괜찮아  가끔 아주 가끔,https://image.bugsm.co.kr/album/images/200/203644/20364406.jpg?version=20201203002409.0,"['국내', '100시리즈', '2021년', '2021 뮤직PD 선곡 TOP100']",2021y
0,0.9818647348665895,6125817,LO$ER=LO♡ER,투모로우바이투게더,혼돈의 장: FIGHT OR ESCAPE,1651,회색빛 차를 타고  달아나고 있어  빌어먹을 세상 너머  네 손을 잡은 내 손  상처뿐이지만          이길 수 없던     이젠 지쳤어  가질 수 없다면          이젠 집어쳐                   미친 듯 크게 웃어줘  눈물은 이제         절대 뒤돌아보지 마  두 손엔                                            전쟁 같은   지기만 했었던 나  넌 내 구원이었어         벼랑 끝에서  너의 빛이 나를 이끌어              밑바닥에서     이젠 지쳤어  거절하겠다면          이젠 집어쳐                   미친 듯 크게 웃어줘  눈물은 이제         절대 뒤돌아보지 마  두 손엔                                            뛰어내려     펼친 채 부러진 날개  영원을 향해   안간힘 써봐도 추락해  너와 함께라면  추락도 아름다워  하늘의 반대편으로  기꺼이 나 가라앉아  그저 서로를 안아줬으면 해  내 어설픈 비행 끝날 때쯤엔  모두가 날 비웃어도     가라앉고 싶어 너의 바다에      미친 듯 크게 웃어줘  눈물은 이제         절대 뒤돌아보지 마  두 손엔                                          ,https://image.bugsm.co.kr/album/images/200/40638/4063847.jpg?version=20210825002634.0,"['NewSongs', ""IT'S NEW! 신곡 에센셜""]",2021y
1,0.460135665743039,6065344,I'm Not Cool,현아,I’m Not Cool,1638,말투와 행동을 꾸민 듯 안 꾸며야 해                사람들 관심에 하게 무심해야 해                     그래 그래 그래          그래 나나나  나도 내 기분 못 맞춰   나보다 독한 건 없어  살모사            뻔해     뻔해     삐까뻔쩍해 내 정신 상태     심한 애  사회적 거리를 둬  새벽이 너무 좋아                            그래 그래 그래          그래 나나나  나도 내 기분 못 맞춰   나보다 독한 건 없어  살모사            뻔해     뻔해                  나는 내가 예쁜데  어쩌라고 예쁜데  너는 누가 예쁜데     나는 내가 예쁜데  나는 나를 예뻐해  너도 너를 예뻐해            뻔해     뻔해     좋아 눈치 없이 나대는 리듬이  좋아 염치없이 춤추는 기분이  옳아 둥둥거리는   리듬이  옳아 쿵쿵거리는 나의 지금이,https://image.bugsm.co.kr/album/images/200/40272/4027244.jpg?version=20210421042905.0,"['국내', '가요', '여름', '여성보컬', 'KPOP', '아이돌']",2021y
1,0.9885046731938495,6046198,동거 (in the bed),선우정아(Sunwoojunga),동거 (in the bed),1630,잠든 너의 맨발을 가만히 보다  왠지 모르게 벅차올라 맺히는 마음  방 안 가득 달큰한 호흡  모든 너의 모든 곳에 입 맞출 수 있어  끈적하게 달라붙은 너와 나의 살에  새벽내내 이슬을 묻혀  저 바깥 바람은  틈만 나면 껴들어 춥게 해  조금 더 안을래 가까이  세상에서 제일 가까이  있잖아 난 너를  아직도 사랑해  시간이 낡았고  모든 게 변했어도  있잖아 우리는  그냥 이대로 살자  대단치 않아도  둘이서 매일을  조그맣게  그림 같은 집을 짓진 못했지만              맘껏 뒹굴거릴 수 있으니까  여긴 완전한 둘의 세계야  저 바깥에서는  감춰 숨겨두었던 모든 것  조금 더 알을래 가까이  너만 느껴지게 가까이  있잖아 난 너를  여전히 사랑해  후회할 리 없지  함께 걷는 이 길을  있잖아 우리는  그냥 이대로 살자  대단치 않아도  둘이서 매일을  조그맣게  우리 한 집에 같이  우리 하루를 같이  우리 여기에 같이  우리 이 길을 같이  우리 한 집에 같이  우리 여기에 같이  우리 하루를 같이  우리 이 길을 같이,https://image.bugsm.co.kr/album/images/200/40228/4022860.jpg?version=20210421042828.0,"['국내', '100시리즈', '2021년', '2021 뮤직PD 선곡 TOP100']",2021y
1,0.5176664891387079,32214940,We are,이승윤,로스쿨 OST Part 1,1597,우린  이제  어딜 향하나  한 줄기 빛이 나에게 내려  멀어진다 해도 그 빛을 따라        여기는 어딘가        나는 널  너는 날  믿는지    한 줄기 빛이 나에게 내려  사라지지 않아 그 빛을 따라        여기는 어딘가        나는 널  너는 날  믿는지    이상과 현실에  진실은 멀리        점점 더 가까이        어둠은  사라져  빛나네        ,https://image.bugsm.co.kr/album/images/200/203922/20392286.jpg?version=20210507180034.0,"['NewSongs', ""IT'S NEW! 신곡 에센셜""]",2021y
0,0.9841854191404062,32220961,365&7 (Feat. JAMIE),pH-1,365&7,1595,생각나 하루도 빠짐없이  너와 나  어느새 비슷한 말투            생각나 하루도 빠짐없이  너와 나  어느새 비슷한 말투       맘이 떨려 어디 하나 고장 난 듯이  함께 있으면 시간은 도망가듯이  빠르게 없어져         비싼 시계를 손목에  감아도 이건 못 멈춰            어디쯤인지  금방 나와있어  널 곧 태우고 갈게 어디든  아주 먼 거리든           네 왼손 내 오른손에 걸어                      바삐 흘러가는 시간 뒤에 숨지마  너무 아까우니까  처음부터 세줄게               생각나 하루도 빠짐없이  너와 나  어느새 비슷한 말투            생각나 하루도 빠짐없이  너와 나  어느새 비슷한 말투                   너도 알잖아  나 이런 거에 약한 거  아침부터 밤까지         기억나             오늘도 고마워  들어가  지금 시땡 우     지금 어디       난 너가 궁금해  네가 궁금해                            바삐 흘러가는 시간 뒤에 숨지마  너무 아까우니까  처음부터 세줄게               생각나 하루도 빠짐없이  너와 나  어느새 비슷한 말투            생각나 하루도 빠짐없이  너와 나  어느새 비슷한 말투     ,https://image.bugsm.co.kr/album/images/200/203937/20393714.jpg?version=20210429180002.0,"['국내', '100시리즈', '2021년', '2021 뮤직PD 선곡 TOP100']",2021y
0,0.9872616812290431,32095542,0415,백예린 (Yerin Baek),tellusboutyourself,1570,내가 정말 잘해야 하는 건지 모르겠어              나도 너처럼 되어야 하는지 모르겠어              내가 네 친구가 될 수 있을지도 잘 모르겠어        난 너에 대해 잘 모르겠어        너도 나에 대해 잘 모르고                 내가 정말 잘해야 하는 건지 모르겠어              나도 너처럼 되어야 하는지 모르겠어              내가 네 친구가 될 수 있을지도 잘 모르겠어        난 너에 대해 잘 모르겠어        너도 나에 대해 잘 모르고         지난주에              한 친구를 만났지만 내 친구가 되진 않았어          그는 그의 말들로 날 재고           내 눈은 쳐다보지도 않더라      난 진지했는데            왜 항상 나여야만 할까         항상 마음이 안 좋아야 하고        나 자신을 눈멀게 해야 하는                내가 정말 잘해야 하는 건지 모르겠어              나도 너처럼 되어야 하는지 모르겠어              내가 네 친구가 될 수 있을지도 잘 모르겠어        난 너에 대해 잘 모르겠어        너도 나에 대해 잘 모르고                 내가 정말 잘해야 하는 건지 모르겠어              나도 너처럼 되어야 하는지 모르겠어              내가 네 친구가 될 수 있을지도 잘 모르겠어        난 너에 대해 잘 모르겠어        너도 나에 대해 잘 모르고                내가 정말 잘해야 하는 건지 모르겠어              나도 너처럼 되어야 하는지 모르겠어              내가 네 친구가 될 수 있을지도 잘 모르겠어        난 너에 대해 잘 모르겠어        너도 나에 대해 잘 모르고                  내가 최근에 멍청한 사랑에 빠졌을 때                  그들이 내 나이 땐 나 같지 않았단 듯이      난 너무 화가 났어            왜 항상 나여야만 할까         부끄러워해야 하고          두려워해야 하는                내가 정말 잘해야 하는 건지 모르겠어              나도 너처럼 되어야 하는지 모르겠어              내가 네 친구가 될 수 있을지도 잘 모르겠어        난 너에 대해 잘 모르겠어        너도 나에 대해 잘 모르고                내가 정말 잘해야 하는 건지 모르겠어              나도 너처럼 되어야 하는지 모르겠어              내가 네 친구가 될 수 있을지도 잘 모르겠어        난 너에 대해 잘 모르겠어        너도 나에 대해 잘 모르고               이건 널 배우게 하려는 내 최선의 방법이야          네가 만나본 적 없는 사랑        내가 최고가 될 수도 있었지만       네가 가졌던 것 중에            너에겐 너무도 낯선 것이겠지      너                내가 정말 잘해야 하는 건지 모르겠어              내가 네 친구가 될 수 있을지도 잘 모르겠어              내가 정말 잘해야 하는 건지 모르겠어              내가 네 친구가 될 수 있을지도 잘 모르겠어              내가 정말 잘해야 하는 건지 모르겠어              내가 네 친구가 될 수 있을지도 잘 모르겠어,https://image.bugsm.co.kr/album/images/200/203663/20366390.jpg?version=20210114171809.0,"['국내', '100시리즈', '2021년', '2021 뮤직PD 선곡 TOP100']",2021y
2,0.9813174080120776,32354385,Tamed-Dashed,ENHYPEN,DIMENSION : DILEMMA,1539,길들여지면 되나  날 매료한 욕망의 그 섬광  꿈은 아름답게  또 추하게  모습을 바꿔 막   얽히고 설켜진  차원 속에 선택의 딜레마  발을 내딛기가  난 겁이 나                일단 뛰어     불꽃에 사로잡혀도 버려진대도  정답은 지금 알 수 없어  뜨거운 심장 나를 데려가  목마른 갈증            일단 뛰어     불타는 태양 날 이끌어가  나의 나침반            그냥 뛰어           정답이 아니라 해도    정답이 아니라 해도   멈춰야만 하나  탁한 시야 꿈에 중독된 나   그리운 어린 날  익숙한 나 보이지가 않아         일단 뛰어     이대로 달린다 해도 멈춘다 해도  결과는 지금 알 수 없어  뜨거운 심장 나를 데려가  목마른 갈증            일단 뛰어     불타는 태양 날 이끌어가  나의 나침반            그냥 뛰어     지긋지긋한 고민  뿔과 뿔 사이에서                         나와 같은 고민에 갇혀있는 너  어떻게 해야 할지 몰라서 멈춰 있는 너  그럴 땐 내 손을 잡고 달려봐  뜨거운 심장 나를 데려가  목마른 갈증            일단 뛰어     불타는 태양 날 이끌어가  나의 나침반            그냥 뛰어           정답이 아니라 해도    정답이 아니라 해도,https://image.bugsm.co.kr/album/images/200/204256/20425653.jpg?version=20211020003234.0,"['NewSongs', ""IT'S NEW! 신곡 에센셜""]",2021y
1,0.8544251149149318,6038839,서로를 위한 것,나얼(Na-Ul),서로를 위한 것,1534,잘 있었냐는 흔한 말 밖엔  떠오르지 않았어  마주친 니 눈빛을 난 애써 피해  아무렇지도 않은 것처럼  웃어 보였지만  떨어진 만큼 우린 참 많이 어색해  나아 보여 넌  여전히 고운  낮은 목소리 그 하얀 얼굴도  서로를 위한 거라면  그만 놓아줄게  우린 처음부터  아무 상관 없었던 것처럼  다시는 없을 거라면  이젠 보내줄게  꿈처럼 희미해져 가는 널 보며  좋아 보여 넌  여전히 맑은  작은 눈동자 투명한 입술도  서로를 위한 거라면  그만 놓아줄게  우린 처음부터  아무 상관 없었던 것처럼  다시는 없을 거라면  이젠 보내줄게  꿈처럼 희미해져 가는 널 보며  아무래도 나는 괜찮아  하얗게 아문 기억 안고 그냥 살아도 돼  마음이 떠난 거라면  그저 바라만 볼게  우린 처음부터  아무 일도 없었던 것처럼  이미 다 끝난 거라면  조금만 간직할게  눈가에 가득 드리워진 널 보며,https://image.bugsm.co.kr/album/images/200/40203/4020328.jpg?version=20210421042809.0,"['국내', '100시리즈', '2021년', '2021 뮤직PD 선곡 TOP100']",2021y
2,0.8047641144792775,32252975,내 입술 따뜻한 커피처럼,청하,내 입술 따뜻한 커피처럼,1518,울지 마 이미 지난 일이야  삶의 반직선 위에 점일 뿐이야  살아가면서 누구나 겪는 일이야  어른이 되는 단지 과정일뿐야   단지 과정일뿐야  제발 이러지 말아요  끝이라는 얘기  나는 항상 시작인 걸요  그댈 사랑하는 마음  점점 커져가고 있는 날  잘 알잖아요  네가 밟고 걷는 땅이 되고 싶던 난  잠시라도 네 입술 따뜻하게 데워준  커피가 되어주고 싶었었던 난  아직도 널 울리고 있을 거야  아마도 난  사랑해 사랑하는 마음 말고 왜  이렇게도 너무  필요한 게 많은 건지 왜  지금 너를 만나지 않아도 널  울리고 있을 내가  나는 왜 이리도 싫은 건지  나를 많이 알잖아요  그댈 사랑하며  나를 모두 버렸다는 걸  혼자 울며 걷는 나를  모르나요  그러니 제발  이러지 마요  그래 어느 하늘 아래 안에  작은 내 사랑  이젠 나의 사랑 한단 말도  의미도 잠시  힘들었던 지나간  나의 넌 기리 위리  우리의 히리 위리  돌릴 수 없는 우리     이제는 되돌리지 못할 거란 걸     아니 너를 사랑한단 걸  오래전 노래처럼 오래오래  널 간직할래 그래  너만을 위한 나의 사랑은 이래       꿈에서라도 싫어요  떠나지 말아요  나는 죽을지도 몰라요  이대로 행복한걸요  모르겠나요  아무것도 바라지 않아  지나간 사랑으로 날  그대의 추억 속에서 살게 할 건가요  사랑은 계속 커져갈 텐데  이대로 나를 정말 보낼 건가요  울지 마 이미 지난 일이야  버틸 수 없을 만큼 힘들겠지만  삶의 반직선 위에 점일 뿐이야  어느때보다도 긴 시간이겠지만  살아가면서 누구나 겪는 일이야  쉽게 받아 들일 수는 없겠지만  어른이 되는 단지 과정일뿐야   단지 과정일뿐야,https://image.bugsm.co.kr/album/images/200/204014/20401457.jpg?version=20210610002945.0,"['국내', '가요', '여름', '여성보컬', 'KPOP', '아이돌']",2021y
2,0.7807741617740523,6122284,외딴섬 로맨틱,잔나비,환상의 나라,1506,어느 외딴섬 로맨틱을  우리 꿈꾸다 떠내려 왔나  때마침 노을빛이 아름답더니  캄캄한 밤이 오더군  이대로 이대로  더 길 잃어도 난 좋아  노를 저으면 그 소릴 난 들을래  쏟아지는 달빛에  오 살결을 그을리고  먼 옛날의 뱃사람을 닮아볼래 그 사랑을  나는 처음부터 다 알고 있었지  거긴 그 무엇도 없다는 것을  그래 넌 두 눈으로 꼭 봐야만 믿잖아  기꺼이 함께 가주지  이대로 이대로  더 길 잃어도 난 좋아  노를 저으면 그 소릴 난 들을래  쏟아지는 달빛에  오 살결을 그을리고  먼 옛날의 뱃사람을 닮아볼래  사랑은 바다 건너 피는 꽃이 아니래  조그만 쪽배에로  파도는 밑줄 긋고  먼 훗날 그 언젠가  돌아가자고 말하면  너는 웃다 고갤 끄덕여줘  참 아름다운 한때야  오 그 노래를 들려주렴  귓가에 피어날 사랑 노래를,https://image.bugsm.co.kr/album/images/200/40594/4059420.jpg?version=20210729063234.0,"['NewSongs', ""IT'S NEW! 신곡 에센셜""]",2021y
