Topic,Percentage,song_id,song_name,artist,album,Like_Count,Lyric,cover_url,tags,year
2,0.9855310640523994,31972746,다시 여기 바닷가,"싹쓰리 (유두래곤, 린다G, 비룡)",다시 여기 바닷가,8120,예아 호우 예예예  싹쓰리 인더 하우스  커커커커커몬 싹 쓰리 투 렛츠고  나 다시 또 설레어  이렇게 너를 만나서  함께 하고 있는 지금 이 공기가  다시는 널 볼 순 없을 거라고  추억일 뿐이라  서랍 속에 꼭 넣어뒀는데  흐르는 시간 속에서  너와 내 기억은  점점 희미해져만 가  끝난 줄 알았어  지난여름 바닷가  너와 나 단둘이  파도에 취해서 노래하며  같은 꿈을 꾸었지  다시 여기 바닷가  이제는 말하고 싶어  네가 있었기에 내가 더욱 빛나  별이 되었다고  다들 덥다고 막 짜증내  괜찮아 우리 둘은 따뜻해  내게 퐁당 빠져버린 널  이젠 구하러 가지 않을 거야  모래 위 펴펴펴편지를 써  밀물이 밀려와도 못 지워  추억이 될 뻔한 첫 느낌  너랑 다시 한번 받아 보고 싶어  흐르는 시간 속에서  너와 내 기억은  점점 희미해져만 가  끝난 줄 알았어  지난여름 바닷가  너와 나 단둘이  파도에 취해서 노래하며  같은 꿈을 꾸었지  다시 여기 바닷가  이제는 말하고 싶어  네가 있었기에 내가 더욱 빛나  별이 되었다고  시간의 강을 건너  또 맞닿은 너와 나  소중한 사랑을 영원히  간직해줘  지난여름 바닷가  너와 나 단둘이  파도에 취해서 노래하며  같은 꿈을 꾸었지  다시 여기 바닷가  이제는 말하고 싶어  네가 있었기에 내가 더욱 빛나  별이 되었다고,https://image.bugsm.co.kr/album/images/200/203385/20338505.jpg?version=20210421045955.0,"['국내', '가요', '연도별 인기가요', '2020년', '2020년대']",2020y
1,0.9933494288147603,6006091,잠이 오질 않네요,장범준,잠이 오질 않네요,7937,당신은 날 설레게 만들어  조용한 내 마음 자꾸만 춤추게 해  얼마나 얼마나 날 떨리게 하는지  당신이 이 밤을 항상 잠 못 들게 해  매일 같은 밤 너를 생각하면서  유치한 노랠 들으며 심장이 춤을 추면서  오오 난 너를 기다리면서  유치한 노랠 부르며 심장이 춤을 추면서 워  나를 떨리게 하나요 그대  왜 나를 설레게 하나요 자꾸만  오늘도 잠 못 이루는 이 밤 아름다운 그대  나를 아프게 하나요 웃는 그대  왜 자꾸 설레게 하나요 하염없이  오늘 밤 잠이 오질 않네요 보고 싶은 그대여  당신이 날 힘들게 만들어  갑자기 내 마음 자꾸만 멍들게 해  얼마나 얼마나 잠 못 들게 하는지  고요한 내 마음 항상 시끄럽게 해  매일 같은 밤 너를 생각하면서  유치한 노랠 들으며 심장이 춤을 추면서  워 난 너를 기다리면서  유치한 노랠 부르며 심장이 춤을 추면서 워  나를 떨리게 하나요 그대  왜 나를 설레게 하나요 자꾸만  오늘도 잠 못 이루는 이 밤 아름다운 그대  나를 아프게 하나요 웃는 그대  왜 자꾸 설레게 하나요 하염없이  오늘 밤 잠이 오질 않네요  보고 싶은 그대여  매일 밤 너를 생각하면서  유치한 노랠 들으며 심장이 춤을 추면서  워오 난 너를 기다리면서  유치한 노랠 부르며 심장이 춤을 추면서 워  나를 떨리게 하나요 그대  왜 나를 설레게 하나요 자꾸만  오늘도 잠 못 이루는 이 밤 아름다운 그대여  나를 아프게 하나요 웃는 그대  왜 자꾸 설레게 하나요 하염없이  오늘 밤 잠이 오질 않네요 보고 싶은 그대여,https://image.bugsm.co.kr/album/images/200/9991/999186.jpg?version=20210421042615.0,"['국내', '가요', '연도별 인기가요', '2020년', '2020년대']",2020y
0,0.9880466846073112,31849691,어떻게 지내 (Prod. By VAN.C),오반 (OVAN),어떻게 지내,7749,어떻게 지내 식상한 말이  내 가사가 될 줄 몰랐어  얼마 안됐네 지나온 날이  다 알아도 그립더라고                    시간이 필요했어 우린 정말 사랑했지만  가살 쓰는 법도 잊어버리게 됐지 난  넌 헤어지면 우리 노랠 제발 내지 말아  달라 했지만 못 들어줘 미안  나는 하루 종일 누워 있었어  불면이 심해져서 안 피곤한 날이 없어  가끔은 문 밖에서 누가 문을 두드려  그건 환상인데도 나는 두려워  다시 눈 뜨면 니가 있을까  그럼 무서운 표정을 지을까  아니면 어떤 대화를 나누고 싶어질 수도  있어 그때처럼  대체 왜 보고싶지 남겨진 상처 대신  남은 건 혼자 돼버린 역시 너와 나겠지  난 아직 낯설기만 해 넌 어때  더 지독해 지기 전에 잊어볼게  어떻게 지내 식상한 말이  내 가사가 될 줄 몰랐어  얼마 안됐네 지나온 날이  다 알아도 그립더라고                    월요일에 병원을 예약했어  너 없이 사는게 힘들었나봐  하루도 빼지 않고 사람을 만나  너도 알겠지만 오봉이도 데려 왔어  너무 그리워하지 않더라 예범이는  난 약을 먹었지만 아닐거야 별일은  자전거를 타고 어디론가 가려하면  다 너와 간 곳 뿐인게 좀 그럴 뿐야  여기저기에 핑계를 대 불면증 습관이 돼  너가 아닌 사람에게 널 원하고  흉터가 된 상처는 더 이상 아프지가 않잖아  그래서 널 그리나봐 이젠 눈물이 나와  널 다치게 하지 않을 순 없었을까  만약 나 때문이었다면 다 나 때문이면  어떻게 지내 식상한 말이  내 가사가 될 줄 몰랐어  얼마 안됐네 지나온 날이  다 알아도 그립더라고                    널 이렇게 망가지게 한 게  나인 건 아닐까  내가 이렇게 망가지다니  대체 왜 병원에 다닐까  널 이렇게 망가지게 한 게  나인 건 아닐까  내가 이렇게 망가지다니  대체 왜 병원에 다닐까,https://image.bugsm.co.kr/album/images/200/203103/20310325.jpg?version=20210421045719.0,"['국내', '가요', '연도별 인기가요', '2020년', '2020년대']",2020y
2,0.8333796657992919,31780292,0310,백예린 (Yerin Baek),Every letter I sent you.,7680,넌 담배를 피며 날 쳐다봤어          난 네가 그럴 때가 싫더라         난 됐다고 말했고           넌 괜찮냐 물었지         안 괜찮다면 뭐 어때          떠나도 괜찮아             난 그냥 또 다시 혼자가 되고 싶지 않은데          항상 그랬듯 항상 그전처럼 말야               넌 내가 너에게 좋지 않을 거란 걸 알았어              네가 좋아하던 것들을 하고나서 누워있을 때 말야             넌 내가 너보다 나은 사람이 아닌 걸 알고 있었어                 네가 떠나도 괜찮아 보일 수 있으면 좋겠어               넌 날 쓰다듬고 빤히 보곤 했지           네가 그럴 때 참 좋았는데           난 너도 나 사랑하는 거 안다고 말했고       난 물었어              넌 똑같은데 내가 그만두면 어쩔 거냐고         떠나는 건 괜찮아             난 또 다시 뒤쳐지기 싫은 거야             항상 그랬듯 모든 마지막 순간처럼 말야                  넌 내가 너에게 좋지않을 거란 걸 알았어              네가 좋아하던 것들을 하고나서 누워있을 때 말야             넌 내가 너보다 나은 사람이 아닌 걸 알고 있었어                 네가 떠나도 괜찮아 보일 수 있으면 좋겠어              갑자기 모든 게 복잡해 보였어                  오직 너만 고칠 수 있지만 내 입이 사실을 말하게 두진 않을 거야             상처받거나 부숴 지지 않는 방법을 알려줘             네가 날 더이상 사랑할 수 없게 돼도 말야                 넌 내가 너에게 좋지 않을 거란 걸 알았어              네가 좋아하던 것들을 하고나서 누워있을 때 말야             넌 내가 너보다 나은 사람이 아닌 걸 알고 있었어                 네가 떠나도 괜찮아 보일 수 있으면 좋겠어            넌 담배를 피며 날 쳐다봤어         난 네가 그럴 때가 싫더라,https://image.bugsm.co.kr/album/images/200/202938/20293803.jpg?version=20191217120002.0,"['국내', '100시리즈', '2020년', '가요', '인디']",2020y
1,0.9918368260574661,30192416,한 발짝 두 발짝,오마이걸(OH MY GIRL),PINK OCEAN,7676,그댄 어디쯤 걷고 있나요                       날씨가 너무 좋아 상상하죠   그대와 손을 잡고 눈을 마주하고                  한숨도 못 잤죠   나 병인가 봐요 맞아요   내가 내가 너를 너를 좋아해     네가 한 발짝 두 발짝 멀어지면   난 세 발짝 다가갈게   우리의 거리가   더 이상 멀어지지 않게   네가 한 발짝 두 발짝 다가오면   난 그대로 서 있을게   우리의 사랑이   빠르게 느껴지지 않게                               시원한 바람 부는 언덕 위에   돗자리 깔고 누워 그대와 있다면                   한숨도 못 잤죠   나 병인가 봐요 맞아요   내가 내가 너를 너를 좋아해     네가 한 발짝 두 발짝 멀어지면   난 세 발짝 다가갈게   우리의 거리가   더 이상 멀어지지 않게   네가 한 발짝 두 발짝 다가오면   난 그대로 서 있을게   우리의 사랑이 빠르게   느껴지지 않게                                   망설이지 마        내게         조금만 더    조금만 더 조금 더 다가와요   더 이상은 멀어지지 마요   조금 더 다가와     네가 한 발짝 두 발짝 멀어지면   난 세 발짝 다가갈게   우리의 거리가   더 이상 멀어지지 않게   네가 한 발짝 두 발짝 다가오면   난 그대로 서 있을게   우리의 사랑이  빠르게 느껴지지 않게                              네가 한 발짝 두 발짝 다가오면   난 그대로 서 있을게   우리의 사랑이   빠르게 느껴지지 않게   않게,https://image.bugsm.co.kr/album/images/200/200268/20026818.jpg?version=20210818003238.0,"['국내', '100시리즈', '2020년']",2020y
0,0.9785979794293945,31908733,Zombie,DAY6 (데이식스),The Book of Us : The Demon,7668,어제는 어떤 날이었나  특별한 게 있었던가  떠올려 보려 하지만  별다를 건 없었던 것 같아  오늘도 똑같이 흘러가  나만 이렇게 힘들까  어떻게 견뎌야 할까  마음껏 소리쳐 울면 나아질까        낮과 밤을 반복하면서        뭔가 바꾸려 해도  할 수 있는 것도  가진 것도 없어 보여          머리와 심장이 텅 빈  생각 없는 허수아비  언제부터 이렇게 된 걸까         난 또 걸어 정처 없이  내일도 다를 것 없이  그저 잠에 들기만을 기다리며 살아        어둠 속에서 눈을 뜬 채로      편히 쉬고 싶어도  꿈꾸고 싶어도  아무것도 하지 못해          머리와 심장이 텅 빈  생각 없는 허수아비  언제부터 이렇게 된 걸까         난 또 걸어 정처 없이  내일도 다를 것 없이  그저 잠에 들기만을 기다리며 살아  다 털어놓고    다 내려놓고     마른 내 눈물을 돌려줘             머리와 심장이 텅 빈  생각 없는 허수아비  언제부터 이렇게 된 걸까         난 또 걸어 정처 없이  내일도 다를 것 없이  그저 잠에 들기만을 기다리며 살아,https://image.bugsm.co.kr/album/images/200/203237/20323788.jpg?version=20200512002352.0,"['국내', '가요', '연도별 인기가요', '2020년', '2020년대']",2020y
0,0.9896399360223974,5800525,HIP,마마무(Mamamoo),reality in BLACK,7605,멋짐  내 마음대로 골라    머리 어깨 무릎 다  해           나를 따라 해      모두 같이      네가 뭐라든 간에    네가 뭘 하든 간에  늘 따끈따끈해 그 관심이 따끔따끔해  또 힐끔 힐끔 힐끔  이젠 모든 일이 가뿐해   성공을 썰어 먹어 마치   누구보다 빠른 걸음을 걸었네 비시즌  잊은 지도 오래야 뒷걸음       멋짐  내 멋대로 골라    머리 어깨 무릎 다   삐삐삐 논란이 돼    별로 신경 안 써 그저   자꾸      홀린 듯이           해    머리 어깨 무릎         해    머리 어깨 무릎       해    어딜 가든 넌   빛날 수 있어  세상에 넌 하나뿐인 걸  근데 왜이래 네 얼굴에 침 뱉니 칵투  날 자극한 여러분 감사  거기서 멈춘 찌질이 반사  덕분에 나의 멘탈은 단단해  난 다음 앨범 만들러 갈게         어그로 끌기  때찌  그런 애들 끼리끼리   삐삐삐 논란이 돼    별로 신경 안 써 그저   자꾸      홀린 듯이           해    머리 어깨 무릎         해    머리 어깨 무릎       해   코 묻은 티  삐져나온 입  떡진 머리  난 상관없지  코 묻은 티  삐져나온 입  떡진 머리  내가 하면   코 묻은 티  삐져나온 팬티  떡진 머리  난 상관없지  코 묻은 티  삐져나온 팬티  떡진 머리  내가 하면   삐삐삐 논란이 돼    별로 신경 안 써 그저   자꾸      홀린 듯이           해    머리 어깨 무릎         해    머리 어깨 무릎       해 ,https://image.bugsm.co.kr/album/images/200/9541/954132.jpg?version=20210421042420.0,"['국내', '가요', '연도별 인기가요', '2020년', '2020년대']",2020y
0,0.9825680088004843,3387407,너의 모든 순간,성시경,별에서 온 그대 (SBS 수목드라마) OST - Part.7,7577,이윽고 내가 한눈에 너를 알아봤을 때  모든 건 분명 달라지고 있었어   내 세상은 널 알기 전과 후로 나뉘어    니가 숨 쉬면 따스한 바람이 불어와  니가 웃으면 눈부신 햇살이 비춰    거기 있어줘서 그게 너라서  가끔 내 어깨에 가만히 기대주어서  나는 있잖아 정말 빈틈없이 행복해  너를 따라서 시간은 흐르고 멈춰    물끄러미 너를 들여다보곤 해  그것 말고는 아무것도 할 수 없어서  너의 모든 순간 그게 나였으면 좋겠다  생각만 해도 가슴이 차올라 나는 온통 너로    보고 있으면 왠지 꿈처럼 아득한 것  몇 광년 동안 날 향해 날아온 별빛 또 지금의 너    거기 있어줘서 그게 너라서  가끔 나에게 조용하게 안겨주어서  나는 있잖아 정말 남김없이 고마워  너를 따라서 시간은 흐르고 멈춰    물끄러미 너를 들여다보곤 해  너를 보는 게 나에게는 사랑이니까  너의 모든 순간 그게 나였으면 좋겠다  생각만 해도 가슴이 차올라 나는 온통 너로  니 모든 순간 나였으면,https://image.bugsm.co.kr/album/images/200/4132/413209.jpg?version=20210203135508.0,"['국내', '100시리즈', '2020년', '가요', '인디']",2020y
0,0.9808358955753668,88794,울트라맨이야,서태지,울트라맨이야,7543,항상 못된 내겐     내게 미쳤다고 그래 모두 그래  다들 그래 맞어 그래 난 더 미치고 싶어  울트라맨 어렸을적 내 꿈엔  울트라맨 여긴 진정 어떤 나라인지  울트라맨 이제부턴 진정 난  울트라맨 수퍼 초울트라 매니아  솔직한 해답을 갖자 영웅이란 존재는 더는 없어  이미 죽은지 오래 무척 오래 저 태양아래  바로 이날의 영웅은 바로 너야  울트라맨 어렸을적 내 꿈엔  울트라맨 여긴 진정 어떤 나라인지  울트라맨 이제부턴 진정 난  울트라맨 수퍼 초울트라 매니아  반듯했던 네겐 울트라 같은 펀치  간듯했던 네겐 울트라 같은 펀치  반듯했던 네겐 울트라 같은 펀치  간듯했던 네겐 울트라 같은 펀치  심사의 세대 닫힌 네겐  서툰 새빛조차 두렵겠지만 난 좋기만해  난 더 기대가 돼 너 다시 내게 짓궂게 굴땐  가만안두리라 넌 이제 울트라의 이름의  심판 받으리라 네 잣대로 다 우릴 논하다  조만간 넌 꼭         항상 못된 내겐     내게 미쳤다고 그래 모두 그래 다들그래  미친 매니아들에 세상 밝은 미친 세상  울트라맨 어렸을적 내 꿈엔  울트라맨 날 바꿨던 어떤 답안지  울트라맨 이제부턴 진정 난  울트라맨 수퍼 초울트라 매니아,https://image.bugsm.co.kr/album/images/200/40/4049.jpg?version=20210114165014.0,"['2020년', '2020년대', '연도별 국내영화OST', '영화', 'OST', '국내', '국내 영화', '영화/드라마']",2020y
0,0.9872511609673484,31299705,너는 어땠을까,노을,별,7449,언제부터인지 습관처럼 연락하고  마주한 시간이 더는 설레질 않아  하루 종일 반복되는 다툼까지도  사소하게 쌓인 오해마저  어떤 말로 풀어야 하는지  익숙한 탓인지 조금은 지겹기도 해  혼자인 시간이 가끔은 그립기도 해  하루 종일 궁금하던 너의 안부도  더는 쉽게 물어볼 수 없는  그런 감정에 하루를 살아  넌 어떻게 지내는 건지  혹시 나와 같은 지 바쁜 일상 속에  내 생각 같은 건 하지 않는지  날 만나 사랑했던 걸  후회하진 않는지 끝이라는 게  생각보다 쉬운 일인 건 아닌지  쉬울 줄 알았어 널 마주하기 전에는  마음과는 달랐어 왜 이렇게 아픈 건지  생각보다 너무 쉽게 잊혀질 걸 알면서  왜 함께한 날들이 떠오르는지  넌 어떻게 지내는 건지  혹시 나와 같은 지 바쁜 일상 속에  내 생각 같은 건 하지 않는지  날 만나 사랑했던 걸  후회하진 않는지 끝이라는 게  생각보다 쉬운 일인 건 아닌지  사실 잠시뿐인 걸 알고는 있지만  어떤 말로 우리를 끝내 보내야 하는지  널 다시 만날 수 있을까  함께 나눈 그 많은 말들과 온기가  거짓말처럼 지워질까  어떤 말도 할 수 없는  마지막을 건네는 너의 표정이  돌아선 지금도 지워지지를 않아  그때의 너는 어떤 마음이었을까,https://image.bugsm.co.kr/album/images/200/202053/20205337.jpg?version=20210616002739.0,"['국내', '100시리즈', '2020년']",2020y
0,0.6753581447534004,31954275,How You Like That,BLACKPINK,How You Like That,7446,보란 듯이 무너졌어  바닥을 뚫고 저 지하까지  옷 끝자락 잡겠다고  저 높이 두 손을 뻗어봐도  다시 캄캄한 이곳에      네 두 눈을 보며      실컷 비웃어라 꼴좋으니까  이제 너희 하나 둘 셋                                                                                                     백 개 중에 백 내 몫을 원해        딱하지만 어쩔 수 없잖아        방아쇠를                     더 캄캄한 이곳에      그 미소를 띠며      실컷 비웃어라 꼴좋으니까  이제 너희 하나 둘 셋                                                                                           날개 잃은 채로 추락했던 날  어두운 나날 속에 갇혀 있던 날  그때쯤에 넌 날 끝내야 했어                                   ,https://image.bugsm.co.kr/album/images/200/203341/20334175.jpg?version=20210428040757.0,"['국내', '가요', '연도별 인기가요', '2020년', '2020년대']",2020y
0,0.5093149185570321,5863186,Filter,방탄소년단,MAP OF THE SOUL : 7,7329,너의 따분한 그 표정 지루한 발끝        핸드폰은 내려놔 고개 돌릴 생각도 마        날 골라 쓰면 돼    너의 눈을 나의 손으로 포개   다가가 비밀에  널 데려갈게 완전히 새로운 세상에   네 감은 눈을 떠봐 이제   팔레트 속 색을 섞어     어떤 나를 원해  너의 세상을 변화시킬     네 맘에 씌워줘   어때 조금 느낌이 와 아직 모자라                   뭐든 돼 줄게  날 골라 쓰면 돼    네 꿈처럼 널 감싸 안을 거야   은밀한 이야  난 너를 위해 매일 새로울 거야  늘 똑같은 건 재미없잖아  팔레트 속 색을 섞어     어떤 나를 원해  너의 세상을 변화시킬     네 맘에 씌워줘  불현듯 아이로 변한 날 봐  볼수록 귀여워 미치도록  취향도 기준도 뛰어넘어  넌 오직 나만을 원하게 돼   날 만든 사람 바로 너니까  난 여태 네가 본 적 없는     내게 널 맡겨봐  더 짜릿한 걸 볼 수 있게     나만을 담아봐               나만을 담아봐               내게 널 맡겨봐  새로운 우리가 될 거야   날 네 맘에 씌워줘,https://image.bugsm.co.kr/album/images/200/203012/20301226.jpg?version=20210428040619.0,"['국내', '100시리즈', '아이돌', '2020년', '가요', '2020 벅스 종합 결산 특집']",2020y
0,0.9839818272953481,54414,난 멈추지 않는다,잼(Zam),Zam,7252,이제 모든걸 다시 시작해  내겐 아직도 시간이 있어  때론 상처가 좌절로 남아  돌이킬수 없는 후회도 하고  그러나 우리 잊어선 안돼  지금의 나는 내가 아닌걸  신문에 실려온 얘기들  헝클어진 우리들을 탓할순 없어  이제 모든걸 다시 시작해  이렇게 여기서 끝낼순 없어  내겐 아직도 시간이 있어  지금 이렇게 지금 멈출수는 없어  신문에 실려온 얘기들  헝클어진 우리들을 탓할순 없어  이제 모든걸 다시 시작해  이렇게 여기서 끝낼순 없어  내겐 아직도 시간이 있어  지금 이렇게 지금  나는 여기서 멈출순 없어  이제 모든걸 다시 시작해  나는 여기서 멈출순 없어  이제 모든걸 다시 시작해,https://image.bugsm.co.kr/album/images/200/54/5467.jpg?version=20200123172229.0,"['2020년', '2020년대', '연도별 국내영화OST', '영화', 'OST', '국내', '국내 영화', '영화/드라마']",2020y
0,0.9712817878501593,6011329,HERO,임영웅,HERO,7102,세상이란 장애물이 너의  앞길을 가로막을 때 날 봐  언제나 너의 곁엔 내가 있어  불안 따윈 도 없을 테니  이렇게    내가 너를 지켜줄게  나를 믿고 가 오  거친 세상이지만  나를 믿고 가 오  나와 함께라면     창밖으로 비쳐오는 태양  시시각각 바뀌는 구름의 모양  공기를 가르며 와닿는  바람의 향기가 느껴지니  이렇게    내가 너를 지켜줄 테니  나를 믿고 가 오  거친 세상이지만  나를 믿고 가 오  나와 함께라면                       참 다행이지 나의 옆이 너라서  내 어깨에 기대어  손을 꼭 잡고 같이  어디로든 가자  나를 믿고 가 오  거친 세상이지만  나를 믿고 가 오  나와 함께라면                     ,https://image.bugsm.co.kr/album/images/200/40122/4012242.jpg?version=20210510122147.0,"['국내', '가요', 'KPOP', '댄스', '2020년', '연말연시', '기간별', '인기/히트곡', '송년회', '신나는', '편집숍/매장', '술집/펍']",2020y
0,0.9725391419838129,31975363,홀로,이하이,홀로,7096,홀로 있는 게 가만히 있는 게  어려운 일인가요  홀로 있어도 같이 있어도  외로운 건 같아요        말하는 대로 생각한 대로  되는 것 아닌가요  햇빛을 쬐고 숨 쉬어 봐도  쉽지는 않네요                       이제 그만 울 거야 나올 거야  나를 더 아껴줄 거야       쟤보다 내가 나보다 쟤가  나은 게 중요한가요  수많은 날을 괴로워하다  이제 좀 알겠어요  가만히 앉아 걱정하기엔  난 너무 소중해요  들여다봐요 맘속의 민낯  그대로 괜찮아요                     이제 그만 울 거야 나올 거야  나를 더 아껴줄 거야            홀로 있는 게 가만히 있는 게  어려운 일인가요  홀로 있어도 같이 있어도  외로운 건 같아요      ,https://image.bugsm.co.kr/album/images/200/203391/20339176.jpg?version=20200724002835.0,"['국내', '가요', '연도별 인기가요', '2020년', '2020년대']",2020y
2,0.5763632557201454,31801957,Nerdy Love (Feat. 백예린),pH-1,Nerdy Love (Feat. 백예린),6907,알람 우는 소리에 난    비가 오고 난 후 날이 개어있어  어제 골라 놓은 옷을    그냥 단정해  잘 몰라 메이커 난  지금 서둘러 너를 데리러  좋아한다며 노란 해질녘  되어주고 싶어 멋진 연인           지난 주 같이 둘이서  본 드라마 속 주인공  처럼 뜨겁고 불이 올라  타오르는 그런   보여주고 싶어   가진 게 난 없고  남자답지 않아  아주 가끔 너도  멋진   때론 원할 텐데  사랑은 그런 게 아냐 바보야                  이런 널 보며 행복할 나를 알잖아                                          그냥 너라서 나는 행복해  그래 너도 비교될 거 알아  친구의 남자친구  덩치도 좋아 등에도 업히고  그런 사진에 좋아요 누른 널 보며  나는 또 내 어깰 못 피고  사람 많은 지하철 안에서  너를 끌어안은 적도  머리 하얘질 정도로 키스하는 법도                 이런 내 멋없는 모습에  너는 왜 그렇게 날 보며  웃는지 환하게            어쩌면 너의 매일은 한심한 나를 향한 배려  가진 게 난 없고  남자답지 않아  아주 가끔 너도  멋진   때론 원할 텐데  사랑은 그런 게 아냐 바보야                  이런 널 보며 행복할 나를 알잖아                                          그냥 너라서 나는 행복해              이해 못해  대체 왜일까  잠을 설쳐  요즘 매일 밤                하지 않길 바랄 뿐 후회만  우린 특별하거든                   ,https://image.bugsm.co.kr/album/images/200/202990/20299011.jpg?version=20200110002345.0,"['국내', '가요', '연도별 인기가요', '2020년', '2020년대']",2020y
